{
  "$schema": "https://json-schema.org/draft/2020-12/schema",
  "$id": "https://skenion.dev/schemas/project/v0.1/project.schema.json",
  "title": "skenion Project Document v0.1",
  "type": "object",
  "required": [
    "schema",
    "schemaVersion",
    "id",
    "documentId",
    "revision",
    "graph",
    "viewState",
    "patchLibrary"
  ],
  "properties": {
    "schema": {
      "const": "skenion.project"
    },
    "schemaVersion": {
      "const": "0.1.0"
    },
    "id": {
      "type": "string",
      "minLength": 1
    },
    "documentId": {
      "type": "string",
      "pattern": "^[0-9a-fA-F]{8}-[0-9a-fA-F]{4}-[0-9a-fA-F]{4}-[0-9a-fA-F]{4}-[0-9a-fA-F]{12}$"
    },
    "revision": {
      "type": "string",
      "minLength": 1
    },
    "metadata": {
      "$ref": "#/$defs/metadata"
    },
    "graph": {
      "$ref": "https://skenion.dev/schemas/graph/v0.1/graph.schema.json"
    },
    "viewState": {
      "$ref": "https://skenion.dev/schemas/view/v0.1/view-state.schema.json"
    },
    "patchLibrary": {
      "type": "array",
      "items": {
        "$ref": "#/$defs/patchDefinition"
      }
    },
    "packageDependencies": {
      "type": "array",
      "items": {
        "$ref": "#/$defs/packageDependency"
      },
      "default": []
    },
    "packageLock": {
      "type": "array",
      "items": {
        "$ref": "#/$defs/packageLockEntry"
      },
      "default": []
    },
    "resourceLock": {
      "type": "array",
      "items": {
        "$ref": "#/$defs/resourceLockEntry"
      },
      "default": []
    },
    "objectBindings": {
      "type": "array",
      "items": {
        "$ref": "#/$defs/objectBinding"
      },
      "default": []
    },
    "tutorial": {
      "type": "object",
      "additionalProperties": true
    },
    "help": {
      "type": "object",
      "additionalProperties": true
    }
  },
  "additionalProperties": false,
  "$defs": {
    "metadata": {
      "type": "object",
      "properties": {
        "title": {
          "type": "string"
        },
        "description": {
          "type": "string"
        },
        "createdAt": {
          "type": "string"
        },
        "updatedAt": {
          "type": "string"
        }
      },
      "additionalProperties": true
    },
    "patchDefinition": {
      "type": "object",
      "required": ["id", "revision", "graph"],
      "properties": {
        "id": {
          "type": "string",
          "minLength": 1
        },
        "revision": {
          "type": "string",
          "minLength": 1
        },
        "metadata": {
          "$ref": "#/$defs/metadata"
        },
        "graph": {
          "$ref": "https://skenion.dev/schemas/graph/v0.1/graph.schema.json"
        },
        "viewState": {
          "$ref": "https://skenion.dev/schemas/view/v0.1/view-state.schema.json"
        }
      },
      "additionalProperties": false
    },
    "packageId": {
      "type": "string",
      "pattern": "^[a-z0-9](?:[a-z0-9-]*[a-z0-9])?/[a-z0-9](?:[a-z0-9-]*[a-z0-9])?$"
    },
    "providedId": {
      "type": "string",
      "pattern": "^[a-z0-9](?:[a-z0-9-]*[a-z0-9])?(?:\\.[a-z0-9](?:[a-z0-9-]*[a-z0-9])?)*$"
    },
    "semver": {
      "type": "string",
      "pattern": "^(0|[1-9][0-9]*)\\.(0|[1-9][0-9]*)\\.(0|[1-9][0-9]*)(?:-[0-9A-Za-z.-]+)?(?:\\+[0-9A-Za-z.-]+)?$"
    },
    "semverRange": {
      "type": "string",
      "pattern": "^>=0\\.[0-9]+\\.[0-9]+ <0\\.[0-9]+\\.[0-9]+$"
    },
    "contractsLine": {
      "type": "string",
      "pattern": "^0\\.[0-9]+$"
    },
    "relativePath": {
      "type": "string",
      "minLength": 1,
      "pattern": "^(?!/)(?!.*(?:^|/)\\.\\.(?:/|$))[A-Za-z0-9._~!$&'()+,;=:@%/-]+$"
    },
    "packageSource": {
      "enum": ["first-party", "marketplace", "workspace", "project-local"]
    },
    "packageCategory": {
      "enum": ["patch", "native", "mixed"]
    },
    "packageRoot": {
      "enum": ["package", "project", "dev-link", "marketplace-install"]
    },
    "packageTrust": {
      "enum": ["trusted", "untrusted", "quarantined"]
    },
    "checksum": {
      "type": "object",
      "required": ["algorithm", "value"],
      "properties": {
        "algorithm": {
          "enum": ["sha256"]
        },
        "value": {
          "type": "string",
          "pattern": "^[a-fA-F0-9]{64}$"
        }
      },
      "additionalProperties": false
    },
    "packageDependency": {
      "type": "object",
      "required": ["packageId", "versionRange", "lockEntryId"],
      "properties": {
        "packageId": {
          "$ref": "#/$defs/packageId"
        },
        "versionRange": {
          "$ref": "#/$defs/semverRange"
        },
        "lockEntryId": {
          "type": "string",
          "minLength": 1
        },
        "required": {
          "type": "boolean"
        }
      },
      "additionalProperties": false
    },
    "packageLockEntry": {
      "type": "object",
      "required": [
        "id",
        "packageId",
        "version",
        "category",
        "source",
        "root",
        "trust",
        "contractsLine",
        "contractsRange",
        "manifestPath",
        "manifestChecksum"
      ],
      "properties": {
        "id": {
          "type": "string",
          "minLength": 1
        },
        "packageId": {
          "$ref": "#/$defs/packageId"
        },
        "version": {
          "$ref": "#/$defs/semver"
        },
        "category": {
          "$ref": "#/$defs/packageCategory"
        },
        "source": {
          "$ref": "#/$defs/packageSource"
        },
        "root": {
          "$ref": "#/$defs/packageRoot"
        },
        "trust": {
          "$ref": "#/$defs/packageTrust"
        },
        "contractsLine": {
          "$ref": "#/$defs/contractsLine"
        },
        "contractsRange": {
          "$ref": "#/$defs/semverRange"
        },
        "manifestPath": {
          "$ref": "#/$defs/relativePath"
        },
        "manifestChecksum": {
          "$ref": "#/$defs/checksum"
        },
        "evidenceRefs": {
          "type": "array",
          "items": {
            "type": "string",
            "minLength": 1
          },
          "uniqueItems": true
        },
        "runtimeAbiRange": {
          "$ref": "#/$defs/semverRange"
        },
        "target": {
          "$ref": "#/$defs/targetTriple"
        },
        "nativeArtifacts": {
          "type": "array",
          "items": {
            "$ref": "#/$defs/nativeArtifact"
          }
        }
      },
      "allOf": [
        {
          "if": {
            "properties": {
              "category": {
                "const": "patch"
              }
            },
            "required": ["category"]
          },
          "then": {
            "not": {
              "anyOf": [
                {
                  "required": ["runtimeAbiRange"]
                },
                {
                  "required": ["target"]
                },
                {
                  "required": ["nativeArtifacts"]
                }
              ]
            }
          }
        },
        {
          "if": {
            "properties": {
              "category": {
                "enum": ["native", "mixed"]
              }
            },
            "required": ["category"]
          },
          "then": {
            "required": ["runtimeAbiRange", "target", "nativeArtifacts"],
            "properties": {
              "nativeArtifacts": {
                "type": "array",
                "items": {
                  "$ref": "#/$defs/nativeArtifact"
                },
                "minItems": 1
              }
            }
          }
        }
      ],
      "additionalProperties": false
    },
    "resourceLockEntry": {
      "type": "object",
      "required": ["id", "lockEntryId", "resourceId", "path", "checksum"],
      "properties": {
        "id": {
          "type": "string",
          "minLength": 1
        },
        "lockEntryId": {
          "type": "string",
          "minLength": 1
        },
        "resourceId": {
          "$ref": "#/$defs/providedId"
        },
        "path": {
          "$ref": "#/$defs/relativePath"
        },
        "checksum": {
          "$ref": "#/$defs/checksum"
        },
        "evidenceRefs": {
          "type": "array",
          "items": {
            "type": "string",
            "minLength": 1
          },
          "uniqueItems": true
        }
      },
      "additionalProperties": false
    },
    "objectProvider": {
      "oneOf": [
        {
          "type": "object",
          "required": ["kind"],
          "properties": {
            "kind": {
              "const": "core"
            }
          },
          "additionalProperties": false
        },
        {
          "type": "object",
          "required": ["kind", "patchId"],
          "properties": {
            "kind": {
              "const": "projectPatch"
            },
            "patchId": {
              "type": "string",
              "minLength": 1
            },
            "revision": {
              "type": "string",
              "minLength": 1
            },
            "interfaceRevision": {
              "type": "string",
              "minLength": 1
            },
            "interfaceDigest": {
              "$ref": "#/$defs/checksum"
            }
          },
          "additionalProperties": false
        },
        {
          "type": "object",
          "required": ["kind", "packageId"],
          "properties": {
            "kind": {
              "const": "package"
            },
            "packageId": {
              "$ref": "#/$defs/packageId"
            },
            "lockEntryId": {
              "type": "string",
              "minLength": 1
            },
            "version": {
              "$ref": "#/$defs/semver"
            }
          },
          "additionalProperties": false
        }
      ]
    },
    "objectImplementation": {
      "type": "object",
      "required": ["provider", "objectId"],
      "properties": {
        "provider": {
          "$ref": "#/$defs/objectProvider"
        },
        "objectId": {
          "type": "string",
          "minLength": 1
        },
        "version": {
          "$ref": "#/$defs/semver"
        },
        "interfaceDigest": {
          "$ref": "#/$defs/checksum"
        }
      },
      "additionalProperties": false
    },
    "objectResolutionCandidate": {
      "type": "object",
      "required": ["implementation"],
      "properties": {
        "implementation": {
          "$ref": "#/$defs/objectImplementation"
        },
        "objectSpec": {
          "type": "string",
          "minLength": 1
        },
        "displayName": {
          "type": "string",
          "minLength": 1
        },
        "reason": {
          "type": "string",
          "minLength": 1
        }
      },
      "additionalProperties": false
    },
    "objectBinding": {
      "type": "object",
      "required": ["id", "objectSpec", "status"],
      "properties": {
        "id": {
          "type": "string",
          "minLength": 1
        },
        "objectSpec": {
          "type": "string",
          "minLength": 1
        },
        "status": {
          "enum": ["resolved", "unresolved", "error"]
        },
        "implementation": {
          "$ref": "#/$defs/objectImplementation"
        },
        "candidates": {
          "type": "array",
          "items": {
            "$ref": "#/$defs/objectResolutionCandidate"
          }
        },
        "diagnostics": {
          "type": "array",
          "items": {
            "$ref": "#/$defs/objectBindingDiagnostic"
          },
          "default": []
        }
      },
      "allOf": [
        {
          "if": {
            "properties": {
              "status": {
                "const": "resolved"
              }
            },
            "required": ["status"]
          },
          "then": {
            "required": ["implementation"]
          }
        },
        {
          "if": {
            "properties": {
              "status": {
                "const": "unresolved"
              }
            },
            "required": ["status"]
          },
          "then": {
            "not": {
              "required": ["implementation"]
            }
          }
        },
        {
          "if": {
            "properties": {
              "status": {
                "const": "error"
              }
            },
            "required": ["status"]
          },
          "then": {
            "required": ["implementation", "diagnostics"],
            "properties": {
              "diagnostics": {
                "type": "array",
                "items": {
                  "$ref": "#/$defs/objectBindingDiagnostic"
                },
                "minItems": 1,
                "contains": {
                  "type": "object",
                  "properties": {
                    "code": {
                      "enum": [
                        "implementation-missing",
                        "implementation-stale",
                        "implementation-lock-mismatch",
                        "interface-drift"
                      ]
                    }
                  },
                  "required": ["code"]
                }
              }
            }
          }
        }
      ],
      "additionalProperties": false
    },
    "objectBindingDiagnostic": {
      "type": "object",
      "required": ["severity", "code", "message"],
      "properties": {
        "severity": {
          "enum": ["error", "warning", "info"]
        },
        "code": {
          "enum": [
            "resolution-unresolved",
            "resolution-ambiguous",
            "implementation-missing",
            "implementation-stale",
            "implementation-lock-mismatch",
            "interface-drift"
          ]
        },
        "message": {
          "type": "string",
          "minLength": 1
        },
        "details": {
          "description": "Arbitrary JSON diagnostic metadata."
        }
      },
      "additionalProperties": false
    },
    "targetTriple": {
      "enum": [
        "aarch64-apple-darwin",
        "x86_64-apple-darwin",
        "x86_64-pc-windows-msvc",
        "aarch64-pc-windows-msvc",
        "x86_64-unknown-linux-gnu",
        "aarch64-unknown-linux-gnu"
      ]
    },
    "nativeArtifact": {
      "type": "object",
      "required": ["target", "path", "entrypoint", "checksum", "evidenceRefs"],
      "properties": {
        "target": {
          "$ref": "#/$defs/targetTriple"
        },
        "path": {
          "$ref": "#/$defs/relativePath"
        },
        "entrypoint": {
          "type": "string",
          "minLength": 1
        },
        "checksum": {
          "$ref": "#/$defs/checksum"
        },
        "evidenceRefs": {
          "type": "array",
          "items": {
            "type": "string",
            "minLength": 1
          },
          "minItems": 1,
          "uniqueItems": true
        }
      },
      "additionalProperties": false
    }
  }
}
