{
  "schema": "skenion.project",
  "schemaVersion": "0.1.0",
  "id": "project-native-package-lock",
  "documentId": "33333333-3333-4333-8333-333333333333",
  "revision": "1",
  "graph": {
    "schema": "skenion.graph",
    "schemaVersion": "0.1.0",
    "id": "root-native-package-lock",
    "revision": "1",
    "nodes": [
      {
        "id": "sensor",
        "objectSpec": "sensor-reading",
        "bindingRef": "binding-sensor-reading",
        "params": {},
        "ports": [],
        "implementation": {
          "provider": {
            "kind": "core"
          },
          "objectId": "custom.external"
        }
      }
    ],
    "edges": []
  },
  "viewState": {
    "schema": "skenion.view-state",
    "schemaVersion": "0.1.0",
    "canvas": {
      "nodes": {}
    }
  },
  "patchLibrary": [
    {
      "id": "native_wrapper",
      "revision": "1",
      "graph": {
        "schema": "skenion.graph",
        "schemaVersion": "0.1.0",
        "id": "patch-native-wrapper",
        "revision": "1",
        "nodes": [],
        "edges": []
      }
    }
  ],
  "packageLock": [
    {
      "id": "pkg-example-native-sensor-0.45.1",
      "packageId": "example/native-sensor",
      "version": "0.45.1",
      "category": "mixed",
      "source": "marketplace",
      "root": "marketplace-install",
      "trust": "trusted",
      "contractsLine": "0.45",
      "contractsRange": ">=0.45.0 <0.46.0",
      "manifestPath": "registry/example/native-sensor/skenion.package.json",
      "manifestChecksum": {
        "algorithm": "sha256",
        "value": "cccccccccccccccccccccccccccccccccccccccccccccccccccccccccccccccc"
      },
      "evidenceRefs": [
        "native-attestation"
      ],
      "runtimeAbiRange": ">=0.45.0 <0.46.0",
      "target": "aarch64-apple-darwin",
      "nativeArtifacts": [
        {
          "target": "aarch64-apple-darwin",
          "path": "registry/example/native-sensor/native/aarch64-apple-darwin/libsensor.dylib",
          "entrypoint": "skenion_native_init",
          "checksum": {
            "algorithm": "sha256",
            "value": "dddddddddddddddddddddddddddddddddddddddddddddddddddddddddddddddd"
          },
          "evidenceRefs": [
            "native-attestation"
          ]
        }
      ]
    }
  ],
  "objectBindings": [
    {
      "id": "binding-sensor-reading",
      "objectSpec": "sensor-reading",
      "status": "resolved",
      "implementation": {
        "provider": {
          "kind": "package",
          "packageId": "example/native-sensor",
          "lockEntryId": "pkg-example-native-sensor-0.45.1"
        },
        "objectId": "example.sensor-reading"
      }
    }
  ]
}
