{
  "schema": "skenion.project",
  "schemaVersion": "0.1.0",
  "id": "project-output-only-patch",
  "documentId": "22222222-2222-4222-8222-222222222222",
  "revision": "1",
  "graph": {
    "schema": "skenion.graph",
    "schemaVersion": "0.1.0",
    "id": "root-output-only-patch",
    "revision": "1",
    "nodes": [],
    "edges": []
  },
  "viewState": {
    "schema": "skenion.view-state",
    "schemaVersion": "0.1.0",
    "canvas": {
      "nodes": {}
    }
  },
  "patchLibrary": [
    {
      "id": "output_only",
      "revision": "1",
      "metadata": {
        "title": "Output Only"
      },
      "graph": {
        "schema": "skenion.graph",
        "schemaVersion": "0.1.0",
        "id": "patch-output-only",
        "revision": "1",
        "nodes": [
          {
            "id": "amplitude_out",
            "params": {
              "portId": "amplitude",
              "label": "Amplitude"
            },
            "ports": [
              {
                "id": "in",
                "direction": "input",
                "type": "value.core.float64",
                "rate": "control",
                "description": "Amplitude value leaving the patch."
              }
            ],
            "implementation": {
              "provider": {
                "kind": "core"
              },
              "objectId": "outlet"
            }
          }
        ],
        "edges": []
      }
    }
  ]
}
